video_clip,audio_clip,video_speaker,audio_speaker,video_emotion,audio_emotion,video_utterance,audio_utterance,video_duration,audio_duration,video_clip_id,audio_clip_id,split,output_stem,label
D:\Documents\Programming\Thesis_G10\data\raw\MELD\MELD-RAW\MELD.Raw\train\train_splits\dia41_utt11.mp4,D:\Documents\Programming\Thesis_G10\data\raw\MELD\MELD-RAW\MELD.Raw\train\train_splits\dia679_utt10.mp4,Mr. Tribbiani,Joey,neutral,joy,Then y'haven't. You're burning your tomatoes.,Am I psyched? The lead in my own TV series? Ive dreamed about this for years! Why have I not been preparing?!,2.67,7.67,train_dia41_utt11,train_dia679_utt10,train,FAKE_T5_train_dia41_utt11__AUDIO_train_dia679_utt10,1
D:\Documents\Programming\Thesis_G10\data\raw\MELD\MELD-RAW\MELD.Raw\train\train_splits\dia696_utt0.mp4,D:\Documents\Programming\Thesis_G10\data\raw\MELD\MELD-RAW\MELD.Raw\train\train_splits\dia657_utt4.mp4,Joey,Rachel,neutral,joy,"Hey Rach! Hey, you mind if I read my comic books in here?",Im just kidding too.  Im getting married in December.,3.84,2.63,train_dia696_utt0,train_dia657_utt4,train,FAKE_T5_train_dia696_utt0__AUDIO_train_dia657_utt4,1
D:\Documents\Programming\Thesis_G10\data\raw\MELD\MELD-RAW\MELD.Raw\train\train_splits\dia463_utt5.mp4,D:\Documents\Programming\Thesis_G10\data\raw\MELD\MELD-RAW\MELD.Raw\train\train_splits\dia434_utt5.mp4,Chandler,Ross,anger,neutral,Well Ive forgotten what it tastes like okay?!,Just wait.,2.71,2.88,train_dia463_utt5,train_dia434_utt5,train,FAKE_T5_train_dia463_utt5__AUDIO_train_dia434_utt5,1
D:\Documents\Programming\Thesis_G10\data\raw\MELD\MELD-RAW\MELD.Raw\train\train_splits\dia768_utt7.mp4,D:\Documents\Programming\Thesis_G10\data\raw\MELD\MELD-RAW\MELD.Raw\train\train_splits\dia843_utt1.mp4,Janice,Chandler,neutral,sadness,Please... go!  Just let me know if you    need a hand!,"I dont know, my mother spent most of her money on her fourth wedding.",4.09,5.46,train_dia768_utt7,train_dia843_utt1,train,FAKE_T5_train_dia768_utt7__AUDIO_train_dia843_utt1,1
D:\Documents\Programming\Thesis_G10\data\raw\MELD\MELD-RAW\MELD.Raw\train\train_splits\dia249_utt5.mp4,D:\Documents\Programming\Thesis_G10\data\raw\MELD\MELD-RAW\MELD.Raw\train\train_splits\dia736_utt10.mp4,Joey,Ross,sadness,fear,Or Friday with no two pizzas!,Okay?,3.25,2.88,train_dia249_utt5,train_dia736_utt10,train,FAKE_T5_train_dia249_utt5__AUDIO_train_dia736_utt10,1
D:\Documents\Programming\Thesis_G10\data\raw\MELD\MELD-RAW\MELD.Raw\train\train_splits\dia117_utt3.mp4,D:\Documents\Programming\Thesis_G10\data\raw\MELD\MELD-RAW\MELD.Raw\train\train_splits\dia347_utt4.mp4,Richard,Phoebe,neutral,sadness,"No its not too soon, I had lunch at a eleven.","Well, umm, my Moms friend, Phoebe, is actually my birth Mom.",2.75,3.46,train_dia117_utt3,train_dia347_utt4,train,FAKE_T5_train_dia117_utt3__AUDIO_train_dia347_utt4,1
D:\Documents\Programming\Thesis_G10\data\raw\MELD\MELD-RAW\MELD.Raw\train\train_splits\dia449_utt1.mp4,D:\Documents\Programming\Thesis_G10\data\raw\MELD\MELD-RAW\MELD.Raw\train\train_splits\dia111_utt13.mp4,Ross,Chandler,neutral,fear,"Hi umm, listen come here, come in.","Take whatever you want, just please dont hurt me.",2.71,2.67,train_dia449_utt1,train_dia111_utt13,train,FAKE_T5_train_dia449_utt1__AUDIO_train_dia111_utt13,1
D:\Documents\Programming\Thesis_G10\data\raw\MELD\MELD-RAW\MELD.Raw\train\train_splits\dia760_utt2.mp4,D:\Documents\Programming\Thesis_G10\data\raw\MELD\MELD-RAW\MELD.Raw\train\train_splits\dia235_utt3.mp4,Chandler,Rachel,fear,joy,Oh no-no-no! Stay! Stay! Because you-you should you-you-you should stay!,Cos I was gonna say theres no way you couldve done the end the way you guys did it back then!,4.09,9.72,train_dia760_utt2,train_dia235_utt3,train,FAKE_T5_train_dia760_utt2__AUDIO_train_dia235_utt3,1
D:\Documents\Programming\Thesis_G10\data\raw\MELD\MELD-RAW\MELD.Raw\train\train_splits\dia466_utt11.mp4,D:\Documents\Programming\Thesis_G10\data\raw\MELD\MELD-RAW\MELD.Raw\train\train_splits\dia452_utt4.mp4,Ross,Joey,anger,neutral,"Oh yeah? Well, I'm rubber, you're glue, whatevercan't do it.  Listen, uh- gimme back my puck.","Yeah well thats because uhI stayed in my room. Yeah, you dont want to look in my hamper.",8.43,9.26,train_dia466_utt11,train_dia452_utt4,train,FAKE_T5_train_dia466_utt11__AUDIO_train_dia452_utt4,1
D:\Documents\Programming\Thesis_G10\data\raw\MELD\MELD-RAW\MELD.Raw\train\train_splits\dia945_utt9.mp4,D:\Documents\Programming\Thesis_G10\data\raw\MELD\MELD-RAW\MELD.Raw\train\train_splits\dia160_utt10.mp4,Guy,Ross,neutral,joy,"Oh believe me, I-I-Ive been there. I had to sort mannequin heads at that Mannequins Plus.","But work comes first!  Oh hey, but that?s sad about you though, what happened? Burn out? Burn all out, did ya?",5.09,9.22,train_dia945_utt9,train_dia160_utt10,train,FAKE_T5_train_dia945_utt9__AUDIO_train_dia160_utt10,1
D:\Documents\Programming\Thesis_G10\data\raw\MELD\MELD-RAW\MELD.Raw\train\train_splits\dia51_utt4.mp4,D:\Documents\Programming\Thesis_G10\data\raw\MELD\MELD-RAW\MELD.Raw\train\train_splits\dia513_utt2.mp4,Ross,Tag,anger,neutral,For what? For letting you throw me out of your office?,How could I have left them in the copy room?,2.63,2.84,train_dia51_utt4,train_dia513_utt2,train,FAKE_T5_train_dia51_utt4__AUDIO_train_dia513_utt2,1
D:\Documents\Programming\Thesis_G10\data\raw\MELD\MELD-RAW\MELD.Raw\train\train_splits\dia1011_utt4.mp4,D:\Documents\Programming\Thesis_G10\data\raw\MELD\MELD-RAW\MELD.Raw\train\train_splits\dia155_utt2.mp4,Ross,Mona,neutral,joy,"Okay, Im done with my choices, these are final.",Hey its Mona! From the wedding.,5.13,2.5,train_dia1011_utt4,train_dia155_utt2,train,FAKE_T5_train_dia1011_utt4__AUDIO_train_dia155_utt2,1
D:\Documents\Programming\Thesis_G10\data\raw\MELD\MELD-RAW\MELD.Raw\train\train_splits\dia670_utt4.mp4,D:\Documents\Programming\Thesis_G10\data\raw\MELD\MELD-RAW\MELD.Raw\train\train_splits\dia635_utt2.mp4,Monica,Monica,joy,neutral,Water rules!,Me neither! We have to get in!,2.63,2.54,train_dia670_utt4,train_dia635_utt2,train,FAKE_T5_train_dia670_utt4__AUDIO_train_dia635_utt2,1
D:\Documents\Programming\Thesis_G10\data\raw\MELD\MELD-RAW\MELD.Raw\train\train_splits\dia192_utt2.mp4,D:\Documents\Programming\Thesis_G10\data\raw\MELD\MELD-RAW\MELD.Raw\train\train_splits\dia638_utt7.mp4,Ross,Mr. Geller,neutral,sadness,Her dying wish was for one last kiss.,Im sorry we cant store your childhood things anymore.,3.38,2.59,train_dia192_utt2,train_dia638_utt7,train,FAKE_T5_train_dia192_utt2__AUDIO_train_dia638_utt7,1
D:\Documents\Programming\Thesis_G10\data\raw\MELD\MELD-RAW\MELD.Raw\train\train_splits\dia94_utt6.mp4,D:\Documents\Programming\Thesis_G10\data\raw\MELD\MELD-RAW\MELD.Raw\train\train_splits\dia740_utt12.mp4,Joanna,Ross,anger,neutral,If youre gonna get all sensitive about it!,Okay?,2.92,2.92,train_dia94_utt6,train_dia740_utt12,train,FAKE_T5_train_dia94_utt6__AUDIO_train_dia740_utt12,1
D:\Documents\Programming\Thesis_G10\data\raw\MELD\MELD-RAW\MELD.Raw\train\train_splits\dia408_utt4.mp4,D:\Documents\Programming\Thesis_G10\data\raw\MELD\MELD-RAW\MELD.Raw\train\train_splits\dia590_utt5.mp4,Phoebe,Kyle,neutral,sadness,"Yeah. Yeah, thats what you need a goodpill.",Me too! Im sorry that guy in the subway licked your neck.,2.5,6.63,train_dia408_utt4,train_dia590_utt5,train,FAKE_T5_train_dia408_utt4__AUDIO_train_dia590_utt5,1
D:\Documents\Programming\Thesis_G10\data\raw\MELD\MELD-RAW\MELD.Raw\train\train_splits\dia164_utt9.mp4,D:\Documents\Programming\Thesis_G10\data\raw\MELD\MELD-RAW\MELD.Raw\train\train_splits\dia840_utt4.mp4,Ross,Phoebe,joy,neutral,"Okay... okay, maybe I will...","Um, um, Rachel can we talk for a sec?",11.34,5.3,train_dia164_utt9,train_dia840_utt4,train,FAKE_T5_train_dia164_utt9__AUDIO_train_dia840_utt4,1
D:\Documents\Programming\Thesis_G10\data\raw\MELD\MELD-RAW\MELD.Raw\train\train_splits\dia174_utt3.mp4,D:\Documents\Programming\Thesis_G10\data\raw\MELD\MELD-RAW\MELD.Raw\train\train_splits\dia916_utt5.mp4,Monica,Ross,joy,neutral,Thank you!    You haven't said anything...,"I mean, theres no point in spending time with someone if-if its just fun.",7.38,5.0,train_dia174_utt3,train_dia916_utt5,train,FAKE_T5_train_dia174_utt3__AUDIO_train_dia916_utt5,1
D:\Documents\Programming\Thesis_G10\data\raw\MELD\MELD-RAW\MELD.Raw\train\train_splits\dia409_utt10.mp4,D:\Documents\Programming\Thesis_G10\data\raw\MELD\MELD-RAW\MELD.Raw\train\train_splits\dia1007_utt3.mp4,Emily,Ross,neutral,anger,"They were so ornate and beautiful, I mean look at that!","Nimitz, and sold over 2,000 boxes.",3.55,4.88,train_dia409_utt10,train_dia1007_utt3,train,FAKE_T5_train_dia409_utt10__AUDIO_train_dia1007_utt3,1
D:\Documents\Programming\Thesis_G10\data\raw\MELD\MELD-RAW\MELD.Raw\train\train_splits\dia753_utt1.mp4,D:\Documents\Programming\Thesis_G10\data\raw\MELD\MELD-RAW\MELD.Raw\train\train_splits\dia548_utt4.mp4,Rachel,Monica,neutral,joy,G.I. Joe,The sun is out!,3.59,3.59,train_dia753_utt1,train_dia548_utt4,train,FAKE_T5_train_dia753_utt1__AUDIO_train_dia548_utt4,1
D:\Documents\Programming\Thesis_G10\data\raw\MELD\MELD-RAW\MELD.Raw\train\train_splits\dia541_utt1.mp4,D:\Documents\Programming\Thesis_G10\data\raw\MELD\MELD-RAW\MELD.Raw\train\train_splits\dia605_utt1.mp4,Carol,Man,joy,anger,Yeah! And maybe someday we could get a place with two bathrooms.,"For God's sake, will you let it go? There's no Rachel!",3.71,4.8,train_dia541_utt1,train_dia605_utt1,train,FAKE_T5_train_dia541_utt1__AUDIO_train_dia605_utt1,1
D:\Documents\Programming\Thesis_G10\data\raw\MELD\MELD-RAW\MELD.Raw\train\train_splits\dia767_utt0.mp4,D:\Documents\Programming\Thesis_G10\data\raw\MELD\MELD-RAW\MELD.Raw\train\train_splits\dia1025_utt4.mp4,Rachel,Joey,joy,neutral,"Ok, I know this is gonna sound really stupid, but I feel that if I can do this, you know, if I can actually do my own laundry, there isn't anything I can't do.",Did you not hear me before when I told you that all of Janines friends are dancers?!,7.47,3.75,train_dia767_utt0,train_dia1025_utt4,train,FAKE_T5_train_dia767_utt0__AUDIO_train_dia1025_utt4,1
D:\Documents\Programming\Thesis_G10\data\raw\MELD\MELD-RAW\MELD.Raw\train\train_splits\dia792_utt12.mp4,D:\Documents\Programming\Thesis_G10\data\raw\MELD\MELD-RAW\MELD.Raw\train\train_splits\dia669_utt2.mp4,Rachel/actress,Barry,anger,joy,But what choice did I have. He was keeping my sister    in a,"Oh, that's great.",3.34,2.79,train_dia792_utt12,train_dia669_utt2,train,FAKE_T5_train_dia792_utt12__AUDIO_train_dia669_utt2,1
D:\Documents\Programming\Thesis_G10\data\raw\MELD\MELD-RAW\MELD.Raw\train\train_splits\dia756_utt5.mp4,D:\Documents\Programming\Thesis_G10\data\raw\MELD\MELD-RAW\MELD.Raw\train\train_splits\dia342_utt18.mp4,Monica,Ross,sadness,neutral,Its hard this whole platonic thing.,You dont think its a little crazy that you get all my points just cause you,3.92,3.13,train_dia756_utt5,train_dia342_utt18,train,FAKE_T5_train_dia756_utt5__AUDIO_train_dia342_utt18,1
D:\Documents\Programming\Thesis_G10\data\raw\MELD\MELD-RAW\MELD.Raw\train\train_splits\dia191_utt0.mp4,D:\Documents\Programming\Thesis_G10\data\raw\MELD\MELD-RAW\MELD.Raw\train\train_splits\dia737_utt3.mp4,Joey,Monica,anger,neutral,Hey! Hey! Be careful around my Porsche!,Deep Impact,3.84,4.3,train_dia191_utt0,train_dia737_utt3,train,FAKE_T5_train_dia191_utt0__AUDIO_train_dia737_utt3,1
D:\Documents\Programming\Thesis_G10\data\raw\MELD\MELD-RAW\MELD.Raw\train\train_splits\dia857_utt7.mp4,D:\Documents\Programming\Thesis_G10\data\raw\MELD\MELD-RAW\MELD.Raw\train\train_splits\dia792_utt13.mp4,Monica,Joey/Drake,neutral,sadness,"Ugh, yknow, umm we gotta get up early and catch that plane for New York.",So what about us? Everything we feel for each other.,3.04,3.25,train_dia857_utt7,train_dia792_utt13,train,FAKE_T5_train_dia857_utt7__AUDIO_train_dia792_utt13,1
D:\Documents\Programming\Thesis_G10\data\raw\MELD\MELD-RAW\MELD.Raw\train\train_splits\dia349_utt3.mp4,D:\Documents\Programming\Thesis_G10\data\raw\MELD\MELD-RAW\MELD.Raw\train\train_splits\dia94_utt4.mp4,Monica,Rachel,neutral,disgust,"So, do you guys wanna come and eat dinner at the restaurant    sometime in the next few weeks?","Oh my God!! Ohh, that is it! Im leaving! You are just a horrible person!",3.5,6.09,train_dia349_utt3,train_dia94_utt4,train,FAKE_T5_train_dia349_utt3__AUDIO_train_dia94_utt4,1
D:\Documents\Programming\Thesis_G10\data\raw\MELD\MELD-RAW\MELD.Raw\train\train_splits\dia240_utt2.mp4,D:\Documents\Programming\Thesis_G10\data\raw\MELD\MELD-RAW\MELD.Raw\train\train_splits\dia226_utt17.mp4,Monica,Tom,neutral,sadness,See?,"I'm gonna go talk to uh, a friend.",3.55,2.67,train_dia240_utt2,train_dia226_utt17,train,FAKE_T5_train_dia240_utt2__AUDIO_train_dia226_utt17,1
D:\Documents\Programming\Thesis_G10\data\raw\MELD\MELD-RAW\MELD.Raw\train\train_splits\dia571_utt13.mp4,D:\Documents\Programming\Thesis_G10\data\raw\MELD\MELD-RAW\MELD.Raw\train\train_splits\dia874_utt9.mp4,Ross,Rachel,anger,neutral,He does not look happy.,"Honey wait, Joey, Im sorry I mean as terrific as I think you are with it",2.88,4.42,train_dia571_utt13,train_dia874_utt9,train,FAKE_T5_train_dia571_utt13__AUDIO_train_dia874_utt9,1
D:\Documents\Programming\Thesis_G10\data\raw\MELD\MELD-RAW\MELD.Raw\train\train_splits\dia896_utt5.mp4,D:\Documents\Programming\Thesis_G10\data\raw\MELD\MELD-RAW\MELD.Raw\train\train_splits\dia1024_utt11.mp4,Phoebe,Joey,neutral,joy,"Well, he may not be my soul mate, but a girls gotta eat.",Very good! Okay. G.,3.25,4.67,train_dia896_utt5,train_dia1024_utt11,train,FAKE_T5_train_dia896_utt5__AUDIO_train_dia1024_utt11,1
D:\Documents\Programming\Thesis_G10\data\raw\MELD\MELD-RAW\MELD.Raw\train\train_splits\dia572_utt19.mp4,D:\Documents\Programming\Thesis_G10\data\raw\MELD\MELD-RAW\MELD.Raw\train\train_splits\dia310_utt6.mp4,Ross,Rachel,anger,sadness,Hey! You wanna live to see your baby?!,"No, but they stuck me in personal shopping. Which is just a",5.59,5.67,train_dia572_utt19,train_dia310_utt6,train,FAKE_T5_train_dia572_utt19__AUDIO_train_dia310_utt6,1
D:\Documents\Programming\Thesis_G10\data\raw\MELD\MELD-RAW\MELD.Raw\train\train_splits\dia279_utt12.mp4,D:\Documents\Programming\Thesis_G10\data\raw\MELD\MELD-RAW\MELD.Raw\train\train_splits\dia109_utt4.mp4,Ross,Monica,neutral,joy,You need me to go down there with you and hold your hand?,"Very good,  so good.",2.63,3.29,train_dia279_utt12,train_dia109_utt4,train,FAKE_T5_train_dia279_utt12__AUDIO_train_dia109_utt4,1
D:\Documents\Programming\Thesis_G10\data\raw\MELD\MELD-RAW\MELD.Raw\train\train_splits\dia633_utt2.mp4,D:\Documents\Programming\Thesis_G10\data\raw\MELD\MELD-RAW\MELD.Raw\train\train_splits\dia154_utt1.mp4,Phoebe,Mark,neutral,joy,Oh my God Monica!,"Okay, okay look, I know I'm being Mr. Inappropriate today, but it's just so tough, I mean see you walking around and I just wanna touch you and hold you, come on no one's around, just, just kiss me.",3.46,10.26,train_dia633_utt2,train_dia154_utt1,train,FAKE_T5_train_dia633_utt2__AUDIO_train_dia154_utt1,1
D:\Documents\Programming\Thesis_G10\data\raw\MELD\MELD-RAW\MELD.Raw\train\train_splits\dia468_utt0.mp4,D:\Documents\Programming\Thesis_G10\data\raw\MELD\MELD-RAW\MELD.Raw\train\train_splits\dia1007_utt5.mp4,Phoebe,Rachel,neutral,sadness,"Oh, I told the stripper to be here at five. Thats good right?","Oh, I blew it. I wouldnt of even hired me.",3.59,5.46,train_dia468_utt0,train_dia1007_utt5,train,FAKE_T5_train_dia468_utt0__AUDIO_train_dia1007_utt5,1
D:\Documents\Programming\Thesis_G10\data\raw\MELD\MELD-RAW\MELD.Raw\train\train_splits\dia859_utt0.mp4,D:\Documents\Programming\Thesis_G10\data\raw\MELD\MELD-RAW\MELD.Raw\train\train_splits\dia382_utt2.mp4,Phoebe,Joey,neutral,joy,"Ursula!  Wait! Err-err, its me! Phoebe!",My little sister Dina!,4.71,2.92,train_dia859_utt0,train_dia382_utt2,train,FAKE_T5_train_dia859_utt0__AUDIO_train_dia382_utt2,1
D:\Documents\Programming\Thesis_G10\data\raw\MELD\MELD-RAW\MELD.Raw\train\train_splits\dia650_utt5.mp4,D:\Documents\Programming\Thesis_G10\data\raw\MELD\MELD-RAW\MELD.Raw\train\train_splits\dia164_utt0.mp4,Monica,Ross,disgust,fear,Please! I am not as bad as Ross.,"You know you probably didn't know this, but back in high school, I had a, um, major crush on you.",6.72,5.59,train_dia650_utt5,train_dia164_utt0,train,FAKE_T5_train_dia650_utt5__AUDIO_train_dia164_utt0,1
D:\Documents\Programming\Thesis_G10\data\raw\MELD\MELD-RAW\MELD.Raw\train\train_splits\dia1022_utt1.mp4,D:\Documents\Programming\Thesis_G10\data\raw\MELD\MELD-RAW\MELD.Raw\train\train_splits\dia82_utt9.mp4,Joey,Chandler,neutral,disgust,Sweepin. Why? Turn you on?,Nobody is gonna be staring at the bride when the father of the groom is wearing a back-less dress.,3.88,6.46,train_dia1022_utt1,train_dia82_utt9,train,FAKE_T5_train_dia1022_utt1__AUDIO_train_dia82_utt9,1
D:\Documents\Programming\Thesis_G10\data\raw\MELD\MELD-RAW\MELD.Raw\train\train_splits\dia230_utt1.mp4,D:\Documents\Programming\Thesis_G10\data\raw\MELD\MELD-RAW\MELD.Raw\train\train_splits\dia486_utt11.mp4,Ross,Joey,joy,fear,Im really glad we came.  Youre so pretty. I love you.,"When I had insurance I could get hit by a bus or catch on fire, yknow?",13.51,4.92,train_dia230_utt1,train_dia486_utt11,train,FAKE_T5_train_dia230_utt1__AUDIO_train_dia486_utt11,1
D:\Documents\Programming\Thesis_G10\data\raw\MELD\MELD-RAW\MELD.Raw\train\train_splits\dia452_utt3.mp4,D:\Documents\Programming\Thesis_G10\data\raw\MELD\MELD-RAW\MELD.Raw\train\train_splits\dia834_utt5.mp4,Rachel,Phoebe,neutral,joy,Really?! How come we didnt cross paths?,"Oh, yeah. Aw, remember the days when you used to go out to the barn, lift up your shirt, and bend over?",2.54,7.55,train_dia452_utt3,train_dia834_utt5,train,FAKE_T5_train_dia452_utt3__AUDIO_train_dia834_utt5,1
D:\Documents\Programming\Thesis_G10\data\raw\MELD\MELD-RAW\MELD.Raw\train\train_splits\dia571_utt0.mp4,D:\Documents\Programming\Thesis_G10\data\raw\MELD\MELD-RAW\MELD.Raw\train\train_splits\dia806_utt15.mp4,Joey,Joey,neutral,fear,"All right now remember, something this big and long is going to be difficult to manuver, fortunately I have a lot of experience in that area.",Listen I uh  Its a scary world out there especially if youre a single mom.,6.97,8.68,train_dia571_utt0,train_dia806_utt15,train,FAKE_T5_train_dia571_utt0__AUDIO_train_dia806_utt15,1
D:\Documents\Programming\Thesis_G10\data\raw\MELD\MELD-RAW\MELD.Raw\train\train_splits\dia434_utt8.mp4,D:\Documents\Programming\Thesis_G10\data\raw\MELD\MELD-RAW\MELD.Raw\train\train_splits\dia945_utt4.mp4,Rachel,Rachel,neutral,sadness,Thanks sweetie.,"Oh honey, come on, Im sorry, I didnt....",2.5,2.67,train_dia434_utt8,train_dia945_utt4,train,FAKE_T5_train_dia434_utt8__AUDIO_train_dia945_utt4,1
D:\Documents\Programming\Thesis_G10\data\raw\MELD\MELD-RAW\MELD.Raw\train\train_splits\dia457_utt7.mp4,D:\Documents\Programming\Thesis_G10\data\raw\MELD\MELD-RAW\MELD.Raw\train\train_splits\dia350_utt3.mp4,Barry,Monica,sadness,joy,"When I went there on what would have been our honeymoon, it was, uh... it was really nice.","Yeah! And I got it on sale, too.",6.3,3.0,train_dia457_utt7,train_dia350_utt3,train,FAKE_T5_train_dia457_utt7__AUDIO_train_dia350_utt3,1
D:\Documents\Programming\Thesis_G10\data\raw\MELD\MELD-RAW\MELD.Raw\train\train_splits\dia553_utt18.mp4,D:\Documents\Programming\Thesis_G10\data\raw\MELD\MELD-RAW\MELD.Raw\train\train_splits\dia22_utt0.mp4,Director,Joey,neutral,disgust,"I dont see it.  You are dancing with the tall guy over there. Tall guy, raise your hand!",Ew! What is that? Something exploded!,5.8,3.42,train_dia553_utt18,train_dia22_utt0,train,FAKE_T5_train_dia553_utt18__AUDIO_train_dia22_utt0,1
D:\Documents\Programming\Thesis_G10\data\raw\MELD\MELD-RAW\MELD.Raw\train\train_splits\dia218_utt2.mp4,D:\Documents\Programming\Thesis_G10\data\raw\MELD\MELD-RAW\MELD.Raw\train\train_splits\dia256_utt0.mp4,Ross,Rachel,neutral,sadness,"Where you work the uh, waiters eat with the waiters, right?","Thats right, still no baby!  Come on people! Please make some room!",3.17,5.55,train_dia218_utt2,train_dia256_utt0,train,FAKE_T5_train_dia218_utt2__AUDIO_train_dia256_utt0,1
D:\Documents\Programming\Thesis_G10\data\raw\MELD\MELD-RAW\MELD.Raw\train\train_splits\dia707_utt14.mp4,D:\Documents\Programming\Thesis_G10\data\raw\MELD\MELD-RAW\MELD.Raw\train\train_splits\dia1021_utt6.mp4,Phoebe,Chandler,anger,neutral,I thought I told you to get outta here!,Is there any chance you didnt see that?,3.13,3.0,train_dia707_utt14,train_dia1021_utt6,train,FAKE_T5_train_dia707_utt14__AUDIO_train_dia1021_utt6,1
D:\Documents\Programming\Thesis_G10\data\raw\MELD\MELD-RAW\MELD.Raw\train\train_splits\dia208_utt11.mp4,D:\Documents\Programming\Thesis_G10\data\raw\MELD\MELD-RAW\MELD.Raw\train\train_splits\dia310_utt3.mp4,Chandler,Monica,joy,sadness,"Okay, bye!  Oh my God!!","Hey, Rach! I made a pile of your stuff over on this side of the room. If you could justthrow your purses at it.",2.59,7.8,train_dia208_utt11,train_dia310_utt3,train,FAKE_T5_train_dia208_utt11__AUDIO_train_dia310_utt3,1
D:\Documents\Programming\Thesis_G10\data\raw\MELD\MELD-RAW\MELD.Raw\train\train_splits\dia389_utt7.mp4,D:\Documents\Programming\Thesis_G10\data\raw\MELD\MELD-RAW\MELD.Raw\train\train_splits\dia623_utt17.mp4,Joey,Ross,neutral,joy,Thats so sweet.  Im gonna get some coffee.,"Oh absolutely! It has been in my family for generations, and every bride who has worn it has had a long and happy life.",5.88,7.34,train_dia389_utt7,train_dia623_utt17,train,FAKE_T5_train_dia389_utt7__AUDIO_train_dia623_utt17,1
D:\Documents\Programming\Thesis_G10\data\raw\MELD\MELD-RAW\MELD.Raw\train\train_splits\dia1016_utt20.mp4,D:\Documents\Programming\Thesis_G10\data\raw\MELD\MELD-RAW\MELD.Raw\train\train_splits\dia392_utt9.mp4,Carol,Joey,neutral,joy,"Look, I-I-I am sorry that Rachel dumped you cause she fell in love with that Mark guy, and you are the innocent victim in all of this, but dont punish your friends for what Rachel did to you.","Kinda, but Ive just been having way too much fun.",7.97,2.84,train_dia1016_utt20,train_dia392_utt9,train,FAKE_T5_train_dia1016_utt20__AUDIO_train_dia392_utt9,1
D:\Documents\Programming\Thesis_G10\data\raw\MELD\MELD-RAW\MELD.Raw\train\train_splits\dia1000_utt0.mp4,D:\Documents\Programming\Thesis_G10\data\raw\MELD\MELD-RAW\MELD.Raw\train\train_splits\dia526_utt19.mp4,Monica,Isabella,disgust,neutral,Would you look at this dump? He hated us. This is his final revenge!,...because I have a list of five goofy coffee house guys and yesterday I bumped you for that guy over there.,4.0,10.93,train_dia1000_utt0,train_dia526_utt19,train,FAKE_T5_train_dia1000_utt0__AUDIO_train_dia526_utt19,1
D:\Documents\Programming\Thesis_G10\data\raw\MELD\MELD-RAW\MELD.Raw\train\train_splits\dia522_utt4.mp4,D:\Documents\Programming\Thesis_G10\data\raw\MELD\MELD-RAW\MELD.Raw\train\train_splits\dia797_utt11.mp4,Phoebe,Monica,neutral,sadness,in Reservations at 8:00 by Neil Simon.  Thank-thank you Neil. Thank you for the words.,"I mean, what am I gonna do without you?",7.63,2.71,train_dia522_utt4,train_dia797_utt11,train,FAKE_T5_train_dia522_utt4__AUDIO_train_dia797_utt11,1
D:\Documents\Programming\Thesis_G10\data\raw\MELD\MELD-RAW\MELD.Raw\train\train_splits\dia62_utt3.mp4,D:\Documents\Programming\Thesis_G10\data\raw\MELD\MELD-RAW\MELD.Raw\train\train_splits\dia777_utt0.mp4,Bob,Rachel,joy,neutral,Toby!,"Well theres yore. And uh, yknow, yesteryear.",2.5,7.63,train_dia62_utt3,train_dia777_utt0,train,FAKE_T5_train_dia62_utt3__AUDIO_train_dia777_utt0,1
D:\Documents\Programming\Thesis_G10\data\raw\MELD\MELD-RAW\MELD.Raw\train\train_splits\dia902_utt2.mp4,D:\Documents\Programming\Thesis_G10\data\raw\MELD\MELD-RAW\MELD.Raw\train\train_splits\dia388_utt8.mp4,Joey,Joey,joy,neutral,Hey! Are those crab cakes?  Did I not tell ya to come straight to me when more crab cakes were ready?,Relax. Here hold this . This old stuff just comes right off.,6.21,4.75,train_dia902_utt2,train_dia388_utt8,train,FAKE_T5_train_dia902_utt2__AUDIO_train_dia388_utt8,1
D:\Documents\Programming\Thesis_G10\data\raw\MELD\MELD-RAW\MELD.Raw\train\train_splits\dia228_utt2.mp4,D:\Documents\Programming\Thesis_G10\data\raw\MELD\MELD-RAW\MELD.Raw\train\train_splits\dia54_utt14.mp4,Joey,Dina,neutral,sadness,"And-and I promise, I won't touch a guitar until you say I'm ready.","Joey, I cant stand the thought of having this baby with you mad at me.",3.71,4.5,train_dia228_utt2,train_dia54_utt14,train,FAKE_T5_train_dia228_utt2__AUDIO_train_dia54_utt14,1
D:\Documents\Programming\Thesis_G10\data\raw\MELD\MELD-RAW\MELD.Raw\train\train_splits\dia36_utt0.mp4,D:\Documents\Programming\Thesis_G10\data\raw\MELD\MELD-RAW\MELD.Raw\train\train_splits\dia588_utt0.mp4,Ross,Chandler,neutral,anger,"Hey, both you guys should be up there with me.",I cant believe I did this! What an idiot!,3.04,2.5,train_dia36_utt0,train_dia588_utt0,train,FAKE_T5_train_dia36_utt0__AUDIO_train_dia588_utt0,1
D:\Documents\Programming\Thesis_G10\data\raw\MELD\MELD-RAW\MELD.Raw\train\train_splits\dia887_utt12.mp4,D:\Documents\Programming\Thesis_G10\data\raw\MELD\MELD-RAW\MELD.Raw\train\train_splits\dia114_utt3.mp4,Ross,Joey,neutral,joy,Maybe we could attack them together?,Its better! You cant go to a museum in your underwear!,2.67,3.71,train_dia887_utt12,train_dia114_utt3,train,FAKE_T5_train_dia887_utt12__AUDIO_train_dia114_utt3,1
D:\Documents\Programming\Thesis_G10\data\raw\MELD\MELD-RAW\MELD.Raw\train\train_splits\dia869_utt8.mp4,D:\Documents\Programming\Thesis_G10\data\raw\MELD\MELD-RAW\MELD.Raw\train\train_splits\dia110_utt5.mp4,Ross,Monica,fear,joy,I don't know you guys.,Hey! How was sailing?,2.63,2.79,train_dia869_utt8,train_dia110_utt5,train,FAKE_T5_train_dia869_utt8__AUDIO_train_dia110_utt5,1
