video_clip,audio_clip,video_speaker,audio_speaker,video_emotion,audio_emotion,video_utterance,audio_utterance,video_duration,audio_duration,video_clip_id,audio_clip_id,split,output_stem,label
D:\Documents\Programming\Thesis_G10\data\raw\MELD\MELD-RAW\MELD.Raw\train\train_splits\dia861_utt2.mp4,D:\Documents\Programming\Thesis_G10\data\raw\MELD\MELD-RAW\MELD.Raw\train\train_splits\dia297_utt1.mp4,Monica,Monica,sadness,joy,"How-how are you, Mom?","Oh. Thank you. Ohhh, thank you very much. Oh, thank you for coming.  Uh, just a second!",2.79,6.01,train_dia861_utt2,train_dia297_utt1,train,FAKE_T5_train_dia861_utt2__AUDIO_train_dia297_utt1,1
D:\Documents\Programming\Thesis_G10\data\raw\MELD\MELD-RAW\MELD.Raw\train\train_splits\dia988_utt2.mp4,D:\Documents\Programming\Thesis_G10\data\raw\MELD\MELD-RAW\MELD.Raw\train\train_splits\dia248_utt6.mp4,Phoebe,Phoebe,neutral,joy,How could it not be?,"Oh, Im sorry. I didnt hear you over all the winning.",3.04,3.25,train_dia988_utt2,train_dia248_utt6,train,FAKE_T5_train_dia988_utt2__AUDIO_train_dia248_utt6,1
D:\Documents\Programming\Thesis_G10\data\raw\MELD\MELD-RAW\MELD.Raw\train\train_splits\dia108_utt6.mp4,D:\Documents\Programming\Thesis_G10\data\raw\MELD\MELD-RAW\MELD.Raw\train\train_splits\dia786_utt2.mp4,Rachel,Rachel,neutral,anger,"Oh thats not important. The point is, I reallyI think everythings gonna be okay.",It’s just so frustrating! Why doesn’t she want my breast?!,11.22,2.79,train_dia108_utt6,train_dia786_utt2,train,FAKE_T5_train_dia108_utt6__AUDIO_train_dia786_utt2,1
D:\Documents\Programming\Thesis_G10\data\raw\MELD\MELD-RAW\MELD.Raw\train\train_splits\dia629_utt1.mp4,D:\Documents\Programming\Thesis_G10\data\raw\MELD\MELD-RAW\MELD.Raw\train\train_splits\dia716_utt4.mp4,Ross,Ross,joy,anger,"Carol, we've been through this before, ok?","If-if Im the only person with any appreciation of the sanctity of the written word, Ill go up there and defend it myself!",2.5,6.76,train_dia629_utt1,train_dia716_utt4,train,FAKE_T5_train_dia629_utt1__AUDIO_train_dia716_utt4,1
D:\Documents\Programming\Thesis_G10\data\raw\MELD\MELD-RAW\MELD.Raw\train\train_splits\dia296_utt8.mp4,D:\Documents\Programming\Thesis_G10\data\raw\MELD\MELD-RAW\MELD.Raw\train\train_splits\dia822_utt4.mp4,Susan,Phoebe,neutral,joy,She.,"No. They said you 'Weren't believable as a human being.' So, you can work on that.",2.54,7.88,train_dia296_utt8,train_dia822_utt4,train,FAKE_T5_train_dia296_utt8__AUDIO_train_dia822_utt4,1
D:\Documents\Programming\Thesis_G10\data\raw\MELD\MELD-RAW\MELD.Raw\train\train_splits\dia109_utt21.mp4,D:\Documents\Programming\Thesis_G10\data\raw\MELD\MELD-RAW\MELD.Raw\train\train_splits\dia336_utt7.mp4,Monica,Monica,joy,anger,I think somebody needs another lap dance.,"No, just, just, just a couple more boxes.",2.59,5.3,train_dia109_utt21,train_dia336_utt7,train,FAKE_T5_train_dia109_utt21__AUDIO_train_dia336_utt7,1
D:\Documents\Programming\Thesis_G10\data\raw\MELD\MELD-RAW\MELD.Raw\train\train_splits\dia338_utt16.mp4,D:\Documents\Programming\Thesis_G10\data\raw\MELD\MELD-RAW\MELD.Raw\train\train_splits\dia844_utt10.mp4,Mr. Burgin,Joey,neutral,joy,"Youll wear that. Well be eating, and of course, youll be wearing that.",Im Joey! Im an actor! I dont know squat about dinosaurs!,5.21,5.88,train_dia338_utt16,train_dia844_utt10,train,FAKE_T5_train_dia338_utt16__AUDIO_train_dia844_utt10,1
D:\Documents\Programming\Thesis_G10\data\raw\MELD\MELD-RAW\MELD.Raw\train\train_splits\dia706_utt4.mp4,D:\Documents\Programming\Thesis_G10\data\raw\MELD\MELD-RAW\MELD.Raw\train\train_splits\dia696_utt7.mp4,Monica,Rachel,neutral,anger,"Y'know, I don't like to brag about it, but I give the",I'm just gonna go over there and confront them right now!,4.5,9.8,train_dia706_utt4,train_dia696_utt7,train,FAKE_T5_train_dia706_utt4__AUDIO_train_dia696_utt7,1
D:\Documents\Programming\Thesis_G10\data\raw\MELD\MELD-RAW\MELD.Raw\train\train_splits\dia15_utt13.mp4,D:\Documents\Programming\Thesis_G10\data\raw\MELD\MELD-RAW\MELD.Raw\train\train_splits\dia985_utt3.mp4,Ross,Estelle,neutral,sadness,"Oh, professor Clerk we're kind of in the middle of a conversation, here.","Well, I think uhh, someone out there may have been bad mouthing you all over town.",3.38,9.01,train_dia15_utt13,train_dia985_utt3,train,FAKE_T5_train_dia15_utt13__AUDIO_train_dia985_utt3,1
D:\Documents\Programming\Thesis_G10\data\raw\MELD\MELD-RAW\MELD.Raw\train\train_splits\dia320_utt11.mp4,D:\Documents\Programming\Thesis_G10\data\raw\MELD\MELD-RAW\MELD.Raw\train\train_splits\dia770_utt5.mp4,Chandler,Chandler,neutral,anger,"Or with the other two women, in the morning yknow I was just lying there and I couldnt wait to just go hang out with my friends, but with you I always yknow with a friend.","Can you just pick one so I can watch--have a perfect, magical weekend together with you.",11.34,6.59,train_dia320_utt11,train_dia770_utt5,train,FAKE_T5_train_dia320_utt11__AUDIO_train_dia770_utt5,1
D:\Documents\Programming\Thesis_G10\data\raw\MELD\MELD-RAW\MELD.Raw\train\train_splits\dia151_utt3.mp4,D:\Documents\Programming\Thesis_G10\data\raw\MELD\MELD-RAW\MELD.Raw\train\train_splits\dia424_utt8.mp4,Ross,Phoebe,joy,neutral,"Wow! This is so amazing. I uh, I really thought Id have to talk you into this more.","If shes no fun, why do you want to date her at all?",5.76,6.3,train_dia151_utt3,train_dia424_utt8,train,FAKE_T5_train_dia151_utt3__AUDIO_train_dia424_utt8,1
D:\Documents\Programming\Thesis_G10\data\raw\MELD\MELD-RAW\MELD.Raw\train\train_splits\dia130_utt10.mp4,D:\Documents\Programming\Thesis_G10\data\raw\MELD\MELD-RAW\MELD.Raw\train\train_splits\dia926_utt4.mp4,Rachel,Chandler,neutral,anger,Im not asking you to go on a,"No, no, I keep trying, yknow?",2.92,3.29,train_dia130_utt10,train_dia926_utt4,train,FAKE_T5_train_dia130_utt10__AUDIO_train_dia926_utt4,1
D:\Documents\Programming\Thesis_G10\data\raw\MELD\MELD-RAW\MELD.Raw\train\train_splits\dia821_utt4.mp4,D:\Documents\Programming\Thesis_G10\data\raw\MELD\MELD-RAW\MELD.Raw\train\train_splits\dia939_utt9.mp4,Ross,Rachel,neutral,sadness,Like the guy on the other side of you was Smelly von Brownshirt.,And you really think this is a good idea?,4.21,3.71,train_dia821_utt4,train_dia939_utt9,train,FAKE_T5_train_dia821_utt4__AUDIO_train_dia939_utt9,1
D:\Documents\Programming\Thesis_G10\data\raw\MELD\MELD-RAW\MELD.Raw\train\train_splits\dia844_utt4.mp4,D:\Documents\Programming\Thesis_G10\data\raw\MELD\MELD-RAW\MELD.Raw\train\train_splits\dia811_utt0.mp4,Ross,Joey,neutral,joy,"Y'know, we work in a museum of natural history, and yet there is something unnatural about the way we eat lunch.",Aaron! You gotta let me go. The guys hammered!,12.35,3.55,train_dia844_utt4,train_dia811_utt0,train,FAKE_T5_train_dia844_utt4__AUDIO_train_dia811_utt0,1
D:\Documents\Programming\Thesis_G10\data\raw\MELD\MELD-RAW\MELD.Raw\train\train_splits\dia514_utt2.mp4,D:\Documents\Programming\Thesis_G10\data\raw\MELD\MELD-RAW\MELD.Raw\train\train_splits\dia245_utt1.mp4,Joey,Phoebe,neutral,joy,"That's great. But uh, I'm not really expecting a lot of calls.","We couldnt keep our eyes off each other all night and then every once and a while yknow, hed kinda lean over and stroke my hair and touch my neck.",4.59,8.09,train_dia514_utt2,train_dia245_utt1,train,FAKE_T5_train_dia514_utt2__AUDIO_train_dia245_utt1,1
D:\Documents\Programming\Thesis_G10\data\raw\MELD\MELD-RAW\MELD.Raw\train\train_splits\dia933_utt15.mp4,D:\Documents\Programming\Thesis_G10\data\raw\MELD\MELD-RAW\MELD.Raw\train\train_splits\dia589_utt0.mp4,Joey,Earl,sadness,neutral,"Okay, but I dont see you asking any other paying customers to put on aprons.",Philadelphia.,3.63,2.67,train_dia933_utt15,train_dia589_utt0,train,FAKE_T5_train_dia933_utt15__AUDIO_train_dia589_utt0,1
D:\Documents\Programming\Thesis_G10\data\raw\MELD\MELD-RAW\MELD.Raw\train\train_splits\dia34_utt8.mp4,D:\Documents\Programming\Thesis_G10\data\raw\MELD\MELD-RAW\MELD.Raw\train\train_splits\dia988_utt3.mp4,Rachel,Phoebe,neutral,sadness,"Okay. All right, that's true! But y'know I just don't embarrass that easily.","I mean pretty soon theyre gonna be having kids, and then theyre just gonna be hanging out with other couples who have kids.",2.79,6.63,train_dia34_utt8,train_dia988_utt3,train,FAKE_T5_train_dia34_utt8__AUDIO_train_dia988_utt3,1
D:\Documents\Programming\Thesis_G10\data\raw\MELD\MELD-RAW\MELD.Raw\train\train_splits\dia589_utt0.mp4,D:\Documents\Programming\Thesis_G10\data\raw\MELD\MELD-RAW\MELD.Raw\train\train_splits\dia966_utt0.mp4,Earl,Ross,neutral,joy,Philadelphia.,"Thats right, I love you! And-and Im gonna play with you all the time.",2.67,7.47,train_dia589_utt0,train_dia966_utt0,train,FAKE_T5_train_dia589_utt0__AUDIO_train_dia966_utt0,1
D:\Documents\Programming\Thesis_G10\data\raw\MELD\MELD-RAW\MELD.Raw\train\train_splits\dia599_utt5.mp4,D:\Documents\Programming\Thesis_G10\data\raw\MELD\MELD-RAW\MELD.Raw\train\train_splits\dia235_utt5.mp4,Joey,Ross,anger,joy,"Uh well yeah, that was the plan, but by the time I got to it there was only a couple of pieces left!","I dont know, I mean you were a lot bigger, I mean, stronger back then.",3.25,4.96,train_dia599_utt5,train_dia235_utt5,train,FAKE_T5_train_dia599_utt5__AUDIO_train_dia235_utt5,1
D:\Documents\Programming\Thesis_G10\data\raw\MELD\MELD-RAW\MELD.Raw\train\train_splits\dia860_utt2.mp4,D:\Documents\Programming\Thesis_G10\data\raw\MELD\MELD-RAW\MELD.Raw\train\train_splits\dia611_utt3.mp4,Phoebe,Ross,fear,neutral,"Umm look, youre coming on a little strong.","Okay, Pheebs: Right hand blue. Good.",2.79,3.09,train_dia860_utt2,train_dia611_utt3,train,FAKE_T5_train_dia860_utt2__AUDIO_train_dia611_utt3,1
D:\Documents\Programming\Thesis_G10\data\raw\MELD\MELD-RAW\MELD.Raw\train\train_splits\dia240_utt0.mp4,D:\Documents\Programming\Thesis_G10\data\raw\MELD\MELD-RAW\MELD.Raw\train\train_splits\dia256_utt0.mp4,Monica,Rachel,neutral,sadness,"David, can you help me?! I'm trying to explain to Chandler how a plane stays in the air.","Thats right, still no baby!  Come on people! Please make some room!",4.88,5.55,train_dia240_utt0,train_dia256_utt0,train,FAKE_T5_train_dia240_utt0__AUDIO_train_dia256_utt0,1
D:\Documents\Programming\Thesis_G10\data\raw\MELD\MELD-RAW\MELD.Raw\train\train_splits\dia200_utt5.mp4,D:\Documents\Programming\Thesis_G10\data\raw\MELD\MELD-RAW\MELD.Raw\train\train_splits\dia379_utt5.mp4,Joey,Rachel,anger,sadness,Can I tell you something? Me too.,"Im sorry, its not very fair to you.",7.92,3.13,train_dia200_utt5,train_dia379_utt5,train,FAKE_T5_train_dia200_utt5__AUDIO_train_dia379_utt5,1
D:\Documents\Programming\Thesis_G10\data\raw\MELD\MELD-RAW\MELD.Raw\train\train_splits\dia351_utt8.mp4,D:\Documents\Programming\Thesis_G10\data\raw\MELD\MELD-RAW\MELD.Raw\train\train_splits\dia666_utt2.mp4,Ross,Joey,joy,neutral,"Oh but not that way. I meanI mean Im not in love with her. I love her like a, like a friend.",You guys got anything to eat? I just went down to Johnos for some chicken and it was closed!,4.38,4.09,train_dia351_utt8,train_dia666_utt2,train,FAKE_T5_train_dia351_utt8__AUDIO_train_dia666_utt2,1
D:\Documents\Programming\Thesis_G10\data\raw\MELD\MELD-RAW\MELD.Raw\train\train_splits\dia274_utt10.mp4,D:\Documents\Programming\Thesis_G10\data\raw\MELD\MELD-RAW\MELD.Raw\train\train_splits\dia147_utt1.mp4,Joey,Chandler,fear,neutral,"I wake up this morning, the strippers gone and the ring is gone!","Oh. Well, hold on camper, are you sure you've thought this thing through?",3.04,3.09,train_dia274_utt10,train_dia147_utt1,train,FAKE_T5_train_dia274_utt10__AUDIO_train_dia147_utt1,1
D:\Documents\Programming\Thesis_G10\data\raw\MELD\MELD-RAW\MELD.Raw\train\train_splits\dia826_utt3.mp4,D:\Documents\Programming\Thesis_G10\data\raw\MELD\MELD-RAW\MELD.Raw\train\train_splits\dia354_utt9.mp4,Chandler,Monica,joy,neutral,Almost as good as that play with the two naked girls on the see-saw.,"Stop with the broom, we're not making noise.",3.96,3.92,train_dia826_utt3,train_dia354_utt9,train,FAKE_T5_train_dia826_utt3__AUDIO_train_dia354_utt9,1
D:\Documents\Programming\Thesis_G10\data\raw\MELD\MELD-RAW\MELD.Raw\train\train_splits\dia890_utt3.mp4,D:\Documents\Programming\Thesis_G10\data\raw\MELD\MELD-RAW\MELD.Raw\train\train_splits\dia558_utt4.mp4,Russell,Rachel,neutral,fear,"Yes, this Russell, Rosss divorce lawyer, just tell him that since I havent heard from him, I assume hes decided to give the marriage a try.","Well, y'know, possibly.  You didnt tell him that, though? Right?",7.92,8.43,train_dia890_utt3,train_dia558_utt4,train,FAKE_T5_train_dia890_utt3__AUDIO_train_dia558_utt4,1
D:\Documents\Programming\Thesis_G10\data\raw\MELD\MELD-RAW\MELD.Raw\train\train_splits\dia1023_utt4.mp4,D:\Documents\Programming\Thesis_G10\data\raw\MELD\MELD-RAW\MELD.Raw\train\train_splits\dia1005_utt8.mp4,Chandler,Phoebe,sadness,neutral,"Well its just my entire family was run out of Scotland byVikings. Anyway, lots of bad memories.",Thatthis milk is mine.,6.8,2.54,train_dia1023_utt4,train_dia1005_utt8,train,FAKE_T5_train_dia1023_utt4__AUDIO_train_dia1005_utt8,1
D:\Documents\Programming\Thesis_G10\data\raw\MELD\MELD-RAW\MELD.Raw\train\train_splits\dia351_utt13.mp4,D:\Documents\Programming\Thesis_G10\data\raw\MELD\MELD-RAW\MELD.Raw\train\train_splits\dia265_utt3.mp4,Dr. Green,Monica,anger,neutral,Well why not? So you can spend your time with this tramp?!,Is that all?,2.84,3.46,train_dia351_utt13,train_dia265_utt3,train,FAKE_T5_train_dia351_utt13__AUDIO_train_dia265_utt3,1
D:\Documents\Programming\Thesis_G10\data\raw\MELD\MELD-RAW\MELD.Raw\train\train_splits\dia604_utt2.mp4,D:\Documents\Programming\Thesis_G10\data\raw\MELD\MELD-RAW\MELD.Raw\train\train_splits\dia277_utt3.mp4,Phoebe,Joey,neutral,anger,"Wow! Thats exciting, you went to Japan, made up a woman.","It was so stupid, I said some stuff in an interview that I shouldnt have said.",3.67,4.55,train_dia604_utt2,train_dia277_utt3,train,FAKE_T5_train_dia604_utt2__AUDIO_train_dia277_utt3,1
D:\Documents\Programming\Thesis_G10\data\raw\MELD\MELD-RAW\MELD.Raw\train\train_splits\dia446_utt17.mp4,D:\Documents\Programming\Thesis_G10\data\raw\MELD\MELD-RAW\MELD.Raw\train\train_splits\dia906_utt4.mp4,Monica,Monica,sadness,neutral,"Either theyre too old, or theyre too young, and then theres Pete whos-whos crazy about me, and whos absolutely perfect for me, and theres like zip going on!",Why does my cinamon stick have an eraser?,8.55,2.63,train_dia446_utt17,train_dia906_utt4,train,FAKE_T5_train_dia446_utt17__AUDIO_train_dia906_utt4,1
D:\Documents\Programming\Thesis_G10\data\raw\MELD\MELD-RAW\MELD.Raw\train\train_splits\dia704_utt1.mp4,D:\Documents\Programming\Thesis_G10\data\raw\MELD\MELD-RAW\MELD.Raw\train\train_splits\dia541_utt11.mp4,Joey,Ross,anger,neutral,"No, no, no, don't! I've been waitin' for like, forever to go out with Lorraine. Just calm down.","Seriously, our sex life I was thinking, maybe I dont know, we could try some-some new things.",7.05,8.51,train_dia704_utt1,train_dia541_utt11,train,FAKE_T5_train_dia704_utt1__AUDIO_train_dia541_utt11,1
D:\Documents\Programming\Thesis_G10\data\raw\MELD\MELD-RAW\MELD.Raw\train\train_splits\dia205_utt4.mp4,D:\Documents\Programming\Thesis_G10\data\raw\MELD\MELD-RAW\MELD.Raw\train\train_splits\dia185_utt7.mp4,Phoebe,Rachel,joy,neutral,"See, there you go, the cleansing works!",I can't believe he remembered!,4.34,3.34,train_dia205_utt4,train_dia185_utt7,train,FAKE_T5_train_dia205_utt4__AUDIO_train_dia185_utt7,1
D:\Documents\Programming\Thesis_G10\data\raw\MELD\MELD-RAW\MELD.Raw\train\train_splits\dia630_utt1.mp4,D:\Documents\Programming\Thesis_G10\data\raw\MELD\MELD-RAW\MELD.Raw\train\train_splits\dia397_utt0.mp4,Phoebe,Joey,joy,anger,Thanks Monica!,Fine! Do you want something to drink?,2.63,3.75,train_dia630_utt1,train_dia397_utt0,train,FAKE_T5_train_dia630_utt1__AUDIO_train_dia397_utt0,1
D:\Documents\Programming\Thesis_G10\data\raw\MELD\MELD-RAW\MELD.Raw\train\train_splits\dia116_utt6.mp4,D:\Documents\Programming\Thesis_G10\data\raw\MELD\MELD-RAW\MELD.Raw\train\train_splits\dia614_utt8.mp4,Ross,Rachel,neutral,joy,I think you would have to clean a whole lot of apartments to go all the way to India.,Well then let's just quit! We'll just quit! Let's all quit!,4.25,2.67,train_dia116_utt6,train_dia614_utt8,train,FAKE_T5_train_dia116_utt6__AUDIO_train_dia614_utt8,1
D:\Documents\Programming\Thesis_G10\data\raw\MELD\MELD-RAW\MELD.Raw\train\train_splits\dia319_utt16.mp4,D:\Documents\Programming\Thesis_G10\data\raw\MELD\MELD-RAW\MELD.Raw\train\train_splits\dia638_utt3.mp4,Pete,Mr. Geller,neutral,joy,"Okay, my trainer, Ho Chi, is teaching me a combination of Gee Koon Doe and Brazilian street fighting, Ive even had my own octagon training ring designed.","Hi. God, it seems like just yesterday you guys used to come out to watch me work.",8.05,4.34,train_dia319_utt16,train_dia638_utt3,train,FAKE_T5_train_dia319_utt16__AUDIO_train_dia638_utt3,1
D:\Documents\Programming\Thesis_G10\data\raw\MELD\MELD-RAW\MELD.Raw\train\train_splits\dia236_utt7.mp4,D:\Documents\Programming\Thesis_G10\data\raw\MELD\MELD-RAW\MELD.Raw\train\train_splits\dia314_utt0.mp4,Chandler,Rachel,neutral,joy,How can I answer that when Im pretending I dont know you?,"Isnt it incredible?! Monica and Chandler, gettin married.",3.04,5.38,train_dia236_utt7,train_dia314_utt0,train,FAKE_T5_train_dia236_utt7__AUDIO_train_dia314_utt0,1
D:\Documents\Programming\Thesis_G10\data\raw\MELD\MELD-RAW\MELD.Raw\train\train_splits\dia797_utt7.mp4,D:\Documents\Programming\Thesis_G10\data\raw\MELD\MELD-RAW\MELD.Raw\train\train_splits\dia464_utt16.mp4,Fake Monica,Rachel,neutral,joy,Oh. Thanks.,"No, I know! I get it! Its funny!",4.88,2.75,train_dia797_utt7,train_dia464_utt16,train,FAKE_T5_train_dia797_utt7__AUDIO_train_dia464_utt16,1
D:\Documents\Programming\Thesis_G10\data\raw\MELD\MELD-RAW\MELD.Raw\train\train_splits\dia180_utt14.mp4,D:\Documents\Programming\Thesis_G10\data\raw\MELD\MELD-RAW\MELD.Raw\train\train_splits\dia475_utt0.mp4,Janice,Monica,joy,anger,Look how nervous he gets! We havent slept together in years!,"I can't believe it's raining again! Oh, it's so unfair!!!",3.67,3.09,train_dia180_utt14,train_dia475_utt0,train,FAKE_T5_train_dia180_utt14__AUDIO_train_dia475_utt0,1
D:\Documents\Programming\Thesis_G10\data\raw\MELD\MELD-RAW\MELD.Raw\train\train_splits\dia0_utt0.mp4,D:\Documents\Programming\Thesis_G10\data\raw\MELD\MELD-RAW\MELD.Raw\train\train_splits\dia148_utt18.mp4,Chandler,Chandler,neutral,anger,also I was the point person on my companys transition from the KL-5 to GR-6 system.,"It's just that we bought a hibachi together, and then he ran off and got married, and things got pretty ugly.",5.67,4.34,train_dia0_utt0,train_dia148_utt18,train,FAKE_T5_train_dia0_utt0__AUDIO_train_dia148_utt18,1
D:\Documents\Programming\Thesis_G10\data\raw\MELD\MELD-RAW\MELD.Raw\train\train_splits\dia428_utt2.mp4,D:\Documents\Programming\Thesis_G10\data\raw\MELD\MELD-RAW\MELD.Raw\train\train_splits\dia256_utt6.mp4,Chandler,Ross,joy,anger,"Oh, thats fine! Go with your instincts, go with your instincts.","And then also umm, Id be far away in the sea.",3.13,3.75,train_dia428_utt2,train_dia256_utt6,train,FAKE_T5_train_dia428_utt2__AUDIO_train_dia256_utt6,1
D:\Documents\Programming\Thesis_G10\data\raw\MELD\MELD-RAW\MELD.Raw\train\train_splits\dia730_utt8.mp4,D:\Documents\Programming\Thesis_G10\data\raw\MELD\MELD-RAW\MELD.Raw\train\train_splits\dia418_utt6.mp4,Ross,Man,joy,neutral,You should take a walk down fifth to the Saint Patrick's Cathedral and there    there's this great little pastry shop that she'd love.,Clifford Burnett.,7.47,3.29,train_dia730_utt8,train_dia418_utt6,train,FAKE_T5_train_dia730_utt8__AUDIO_train_dia418_utt6,1
D:\Documents\Programming\Thesis_G10\data\raw\MELD\MELD-RAW\MELD.Raw\train\train_splits\dia1025_utt16.mp4,D:\Documents\Programming\Thesis_G10\data\raw\MELD\MELD-RAW\MELD.Raw\train\train_splits\dia699_utt13.mp4,Joey,The Security Guard,neutral,anger,Ross! Can I talk to you for a second?,I'm just taking you outside!,2.92,2.5,train_dia1025_utt16,train_dia699_utt13,train,FAKE_T5_train_dia1025_utt16__AUDIO_train_dia699_utt13,1
D:\Documents\Programming\Thesis_G10\data\raw\MELD\MELD-RAW\MELD.Raw\train\train_splits\dia413_utt4.mp4,D:\Documents\Programming\Thesis_G10\data\raw\MELD\MELD-RAW\MELD.Raw\train\train_splits\dia240_utt3.mp4,Joey,Chandler,neutral,fear,"Nope. Op, wait! There he goes.","Yeah, that's the same as ""it has something to do with wind"".",2.71,3.46,train_dia413_utt4,train_dia240_utt3,train,FAKE_T5_train_dia413_utt4__AUDIO_train_dia240_utt3,1
D:\Documents\Programming\Thesis_G10\data\raw\MELD\MELD-RAW\MELD.Raw\train\train_splits\dia1009_utt17.mp4,D:\Documents\Programming\Thesis_G10\data\raw\MELD\MELD-RAW\MELD.Raw\train\train_splits\dia692_utt1.mp4,Phoebe,Rachel,joy,neutral,"Oh, I wanna see! Lemme see! Lemme see!","Oh it's OK. You were worth the wait, and I don't just mean tonight.",5.55,5.51,train_dia1009_utt17,train_dia692_utt1,train,FAKE_T5_train_dia1009_utt17__AUDIO_train_dia692_utt1,1
D:\Documents\Programming\Thesis_G10\data\raw\MELD\MELD-RAW\MELD.Raw\train\train_splits\dia392_utt5.mp4,D:\Documents\Programming\Thesis_G10\data\raw\MELD\MELD-RAW\MELD.Raw\train\train_splits\dia62_utt3.mp4,Phoebe,Bob,neutral,joy,I just say someone on thethat looks just like you on the subway.,Toby!,2.84,2.5,train_dia392_utt5,train_dia62_utt3,train,FAKE_T5_train_dia392_utt5__AUDIO_train_dia62_utt3,1
D:\Documents\Programming\Thesis_G10\data\raw\MELD\MELD-RAW\MELD.Raw\train\train_splits\dia516_utt4.mp4,D:\Documents\Programming\Thesis_G10\data\raw\MELD\MELD-RAW\MELD.Raw\train\train_splits\dia649_utt23.mp4,Chandler,Joey,joy,anger,I can see it from right here. Itll cost you one husband.,"No-no-no-no, hes not! No! Why are you trying to ruin the game? Come on!",4.5,9.38,train_dia516_utt4,train_dia649_utt23,train,FAKE_T5_train_dia516_utt4__AUDIO_train_dia649_utt23,1
D:\Documents\Programming\Thesis_G10\data\raw\MELD\MELD-RAW\MELD.Raw\train\train_splits\dia363_utt1.mp4,D:\Documents\Programming\Thesis_G10\data\raw\MELD\MELD-RAW\MELD.Raw\train\train_splits\dia182_utt1.mp4,Rachel,Rachel,neutral,sadness,"No, honey, they're not, but don't worry, because we are going to find them, and until we do, we are all here for you, ok?",I just saw Danny getting on the subway with a girl and he had his arm around her.,3.17,5.09,train_dia363_utt1,train_dia182_utt1,train,FAKE_T5_train_dia363_utt1__AUDIO_train_dia182_utt1,1
D:\Documents\Programming\Thesis_G10\data\raw\MELD\MELD-RAW\MELD.Raw\train\train_splits\dia47_utt15.mp4,D:\Documents\Programming\Thesis_G10\data\raw\MELD\MELD-RAW\MELD.Raw\train\train_splits\dia756_utt5.mp4,Joey,Monica,joy,sadness,"Oh, yeah. He's got that great baby smell. Get a whiff of his head.",Its hard this whole platonic thing.,3.29,3.92,train_dia47_utt15,train_dia756_utt5,train,FAKE_T5_train_dia47_utt15__AUDIO_train_dia756_utt5,1
D:\Documents\Programming\Thesis_G10\data\raw\MELD\MELD-RAW\MELD.Raw\train\train_splits\dia313_utt2.mp4,D:\Documents\Programming\Thesis_G10\data\raw\MELD\MELD-RAW\MELD.Raw\train\train_splits\dia426_utt7.mp4,Joey,Phoebe,neutral,sadness,I can fix it. Hold on.  Look out. Look out.,"Im sorry, I thought I could do it and I cant!",5.09,2.88,train_dia313_utt2,train_dia426_utt7,train,FAKE_T5_train_dia313_utt2__AUDIO_train_dia426_utt7,1
D:\Documents\Programming\Thesis_G10\data\raw\MELD\MELD-RAW\MELD.Raw\train\train_splits\dia376_utt3.mp4,D:\Documents\Programming\Thesis_G10\data\raw\MELD\MELD-RAW\MELD.Raw\train\train_splits\dia449_utt1.mp4,Phoebe,Ross,fear,neutral,Wow! Nice! Manly and also kind of a slut.,"Hi umm, listen come here, come in.",4.63,2.71,train_dia376_utt3,train_dia449_utt1,train,FAKE_T5_train_dia376_utt3__AUDIO_train_dia449_utt1,1
D:\Documents\Programming\Thesis_G10\data\raw\MELD\MELD-RAW\MELD.Raw\train\train_splits\dia176_utt2.mp4,D:\Documents\Programming\Thesis_G10\data\raw\MELD\MELD-RAW\MELD.Raw\train\train_splits\dia936_utt10.mp4,Rachel,Phoebe,neutral,sadness,"Aww, look at the little thing.",Thats not why youre going!,2.75,3.21,train_dia176_utt2,train_dia936_utt10,train,FAKE_T5_train_dia176_utt2__AUDIO_train_dia936_utt10,1
D:\Documents\Programming\Thesis_G10\data\raw\MELD\MELD-RAW\MELD.Raw\train\train_splits\dia549_utt2.mp4,D:\Documents\Programming\Thesis_G10\data\raw\MELD\MELD-RAW\MELD.Raw\train\train_splits\dia541_utt0.mp4,Joey,Ross,sadness,joy,"Oh thats too bad. Ive kinda been saving up.  Uh, are you sure theres no studies I can participate in?","So honey, this morning was fun, huh? Me hopping in on you in the shower there.",9.55,5.71,train_dia549_utt2,train_dia541_utt0,train,FAKE_T5_train_dia549_utt2__AUDIO_train_dia541_utt0,1
D:\Documents\Programming\Thesis_G10\data\raw\MELD\MELD-RAW\MELD.Raw\train\train_splits\dia450_utt13.mp4,D:\Documents\Programming\Thesis_G10\data\raw\MELD\MELD-RAW\MELD.Raw\train\train_splits\dia564_utt9.mp4,Monica,Monica,neutral,sadness,I know.  I need more pie.,All I had to do was pay $25 and wait in line for three hours.,3.67,2.79,train_dia450_utt13,train_dia564_utt9,train,FAKE_T5_train_dia450_utt13__AUDIO_train_dia564_utt9,1
D:\Documents\Programming\Thesis_G10\data\raw\MELD\MELD-RAW\MELD.Raw\train\train_splits\dia911_utt0.mp4,D:\Documents\Programming\Thesis_G10\data\raw\MELD\MELD-RAW\MELD.Raw\train\train_splits\dia128_utt6.mp4,Joey,Phoebe,joy,neutral,"Well I had a great time! Learned how to bake, ate great food, thats the first A Ive gotten since seventh grade,","Thats right, you just enjoy.",12.35,2.96,train_dia911_utt0,train_dia128_utt6,train,FAKE_T5_train_dia911_utt0__AUDIO_train_dia128_utt6,1
